,,2,,,,,,,,NOTE:  Data corrections in EDC were initiated before MB was made aware of the issue.  The unlock date of 1/29/21 is the date I became aware of the issue and discussed with the CDS lead.,,,,,,"[2/3/21 update]  Before signing the unlock documentation I asked if there was the potential for additional data issues to be identified when the final TLFs (and updates from this dry run) were received.  Joanne Nagel's response was ""The team agreed in our last cross-functional call that once Dry Run #2 updates are made specific to EDC changes that we will not go through this exercise again and that the EDC changes are a finite list and no more changes/updates moving forward. This was stressed to CLIN MED multiple times during the call and they agreed.""",
TAK-951-1001,TAK-951-1001,1,GI,PRA EDS,Final,22-Feb-21,24-Feb-21,2-Mar-21,TTDOM,While completing TLF programming post lock it was discovered that EG SDTM dataset was missing EGTPT and EGTPTNUM. These data need to be added to the SDTM EG dataset to complete analysis.,SDTM ,SDTM domains: EG,SDTM mapping error and Lack of Dry Run TLF review,,,"The issue is on the ECG 12 Lead CRF. The ECG CRF is present at the Screening, Day -1, Day 2, ET & Unscheduled visits. The Day 2 ECG CRF has a hardcoded “24 hour” Planned Time Point. This specific Day 2 CRF was not annotated with the EGTPT and EGTPTNUM and the EGTPT/EGTPTNUM is not included in the SDTM dataset. This issue was not identified as part of SDTM Oversight performed by CDS and SQS or external review by Etera. Per PRA: There was no dry run of TFLs but an interim of some TFLs back in April/May of 2020. It was not caught at the time of lock because the timepoint is only applicable to Part 3 of the study and Part 1 was only included in the interim TFLs. When SDTM was initially built, there was no data applicable to this variable.",
TAK-994-1503,TAK-994-1503,1,Neuro,PRA EDS,Final,28-Jan-21,9-Mar-21,11-Mar-21,TTDOM,"While completing TLF review, SQS discovered that LBSTRES- variables were not populated with SI Units as expected per CDISC/FDA conformance rules and Takeda's table shell requirements. While the database was unlocked, select findings in other domains that were unresolved at the time of lock were also corrected.",SDTM ,LB,SDTM programming error and lack of full Dry Run TLF review,,QE,"PRA has opened a QE. Note that PRA EDS does not conform to TTDOM principles or industry best practice of generating a SDTM Spec. Also, while a topline dry run was performed due to the exceptional criticality of this study, safety tables were not included and therefore this critical finding was not caught pre-lock.",
TAK-831-2002,TAK-831-2002,1,Neuro,IQVIA,Final,12-Feb-21,25-Mar-21,7-Apr-21,TOP,"Upon review of the topline results, SQS discovered that IQVIA had failed to program baseline per the SAP. The quality investigation also uncovered data nuances in the AiCure data transfer that were not previously understood which resulted in imprecise SDTM mapping of the AiCure data (in DM) and identification of additional protocol deviations. The database was unlocked to enhance the SDTM data mapping/programming and update the protocol deviations source data.","SDTM, Protocol deviations","DM, DV","Dosing diary data, SDTM programming error, protocol deviations data",,QE,IQVIA has opened a QE.,
TAK-935-2002 (Elektra),,2,Neuro,PPD,Final,N/A (lock performed by OVID),3-May-21,,N/A,"Disposition (end of treatment and end of study reasons missing for several subjects or invalid per source); Demographics Race data inconsistent with source. Takeda petitioned OVID repeatedly to correct prior to final CSR; now that Takeda is Sponsor, we are proceeding with corrections.",EDC,"DM, DS",,,,"These don’t change the efficacy outcome/conclusions, but these errors provide unnecessary risk and complexity to annual reporting, integrated analyses, and eventual submission(s) and Regulatory review/dialogue. The errors are in the most fundamental datasets and, given such a small patient population, the cross-functional leaders involved have continued to pursue corrections for data integrity and submission-readiness.",
TAK-659 C34008,,2,Early Onc,PRA PR,Final,25-Feb-21,14-May-21,,TDOM 1.0,"PK raw data not mapped to SDTM. In previous IA, raw PK datasets were used for analysis. This vendor data had been incorporated into SDTM shortly before DBL. No dry run was ever conducted on this data. Also, data reconciliation listings were not programmed to individual collection timepoints and PRA monitors did not implement a manual correction step for an EDC flaw.",SDTM,PK,"PK review, lack of dry run, 3rd party reconciliation, SDTM programming",,,Technically the database is still open bc of one active patient. PRA did run their TDOM 1.0 Data Unlock corrective actions on this database prior to lock with supervision of a CDS Lead (assigned approx 1 mo prior to DBL for this activity),
SHP721-301,,2,GI,PPD,Final,,,,,Correct reponses for dilation history and include new histology data (new CRF) at request of FDA.,,,,,,,
SHP721-302,,2,GI,PPD,Final,,,,,Correct reponses for dilation history and include new histology data (new CRF) at request of FDA.,,,,,,,
SHP-643-302,,2,RGH,IQVIA,Interim,28-May-21,9-Jun-21,15-Jun-21,TTDOM (previously CTOM),"IQVIA Biostatistics found an issue in SDTM.IS when checking outputs prepared for 2nd interim analysis after SDTM database lock on 28/May2021. The issue was identified during IQVIA internal Quality Control Review of TLF before the finalization. The records of “VISIT 28 DAY 392/EOS” for subject “007-0001” and “004-0001” were not included in SDTM.IS while the data was collected in raw.ADA (Visit 28 Day 392 / EOS/ET) and raw.F_ADA_MAND (evtV28D392EOS). In the program of SDTM, IQVIA Biostatistics merged raw.ADA (Vendor data) and raw.F_ADA_MAND (CRF data) by subject, visit and datetime. But it was missed to fix the value of EOS visit for merging raw.ADA and raw.F_ADA_MAND in SDTM programming after having received the new data for 2nd interim analysis. As a result, EOS visit records were not included in SDTM.IS. IQVIA Biostatistics double checked all other visits and there was no issue. Given that this is full spectrum of possible visits for this study, a similar issue will not happen in the final database lock.",SDTM,ADA,,,,,
TAK-935-2004 (ARCADE),TAK-935-2004,1,Neuro,PeachTree,Final,N/A (lock performed by OVID),8-Jun-21,9-Jun-21,N/A,Source documentation that contained PIH loaded into EDC by previous Sponsor as part of Covid-19 mitigation efforts for source doc verification/monitoring. Docs removed.,EDC,Other,Monitoring,N,N,Incident reported to Quality and Data Privacy Office - both weighed in on proper action to take.,
